job_id,title,company,job_level,salary_min,salary_max,salary_text,location,skills,url,search_keyword,skill_count
2044911,Technical Assistant (Trợ Lý Kỹ Thuật),Vinfast Global,Fresher/Entry level,0.0,0.0,0,Hà Nội,"Technical Support, Jira, Process Improvement, Technical skills, English",,IT support,5
2039970,Technical Solution Development Executive,Công Ty CP Công Nghiệp Vĩnh Tường Việt Nam,Experienced (non-manager),0.0,0.0,0,Hồ Chí Minh,"Material Applications Knowledge, Material Development, Technical Solutions, Engineering Product, Technical Support",,IT support,5
2047653,Customer Service Coordinator,BD Agriculture (Vietnam) Co. Ltd,Experienced (non-manager),0.0,0.0,0,Hồ Chí Minh,"Mechanical engineer, Service Engineer, Sales Support, Customer Service, Technical Support",,IT support,5
2049561,Sales Representative,SHOJI FRANK VIETNAM,Experienced (non-manager),0.0,0.0,0,Hồ Chí Minh,"Bán Hàng, communication, Technical Support, Customer Service, Customer Relation",,IT support,5
2027996,Tuyển Thực Tập Sinh - Ngành Nhiệt/nhiệt Lạnh (Có Lương + Training Thực Tế Dự Án),CÔNG TY TNHH SẢN PHẨM TIÊU DÙNG TOSHIBA VIỆT NAM,Fresher/Entry level,0.0,0.0,0,Hồ Chí Minh,"HVAC Maintenance, HVAC System, Repairing Equipment, Technical Diagnostics, Technical Support",,IT support,5
2040222,Field Service Engineer,Alfa Laval Vietnam LLC,Experienced (non-manager),0.0,0.0,0,Hồ Chí Minh,"Field Service Engineering, Troubleshooting Skills, Technical Support, Mechanical Maintenance, Repairing Equipment",,IT support,5
2028780,R&D Engineer,Công Ty TNHH Bonfiglioli Việt Nam,Experienced (non-manager),0.0,0.0,0,Hồ Chí Minh,"Electric Motor Testing, Product Development, Engineering, Technical Support, Product engineering",,IT support,5
2042803,Junior Sales Assistant,Công ty TNHH Schoeller-Bleckmann Việt Nam,Experienced (non-manager),0.0,0.0,0,Bình Dương,"Admin, Sales Admin, Sales Administration, Sales Support, Technical Sales Support",,IT support,5
2049094,Technical Sales Engineer,Công Ty TNHH Ehwa Tech,Experienced (non-manager),0.0,0.0,0,Bắc Ninh,"Technical Sales, Market Development, Technical Support, Account Management, Communication",,IT support,5
2043320,Service/ SI Engineer – Team Leader/ Senior/ Junior (8 Positions),Quantel Global Vietnam Co. Ltd,Fresher/Entry level,0.0,0.0,0,Hải Phòng,"English, Quotation Preparation, Semiconductor, Technical Service, Technical Support",,IT support,5
2037750,Technical Sale Support (Estimator - Hybrid Working),Công Ty TNHH Công Nghiệp T.A Việt Nam,Experienced (non-manager),0.0,0.0,0,Hồ Chí Minh,"Blueprint Drawing, Quantity Survey, Mechanical Engineering, HVAC, QS",,IT support,5
2026670,Application Engineer (Instrumentation & Control),Công Ty TNHH Azbil Việt Nam,Fresher/Entry level,0.0,0.0,0,Hồ Chí Minh,"Automation Engineering, Electrical Engineering, Mechatronics Engineering, Application Control, Technical Support",,IT support,5
2048718,"Assistant Manager, Facilities Management",Frasers Property Vietnam,Manager,0.0,0.0,0,Bình Dương,"EHS, Facilities Management, Maintenance Management, Risk Assessment, Technical Support",,IT support,5
2026375,Key Account Executive (Retail Điện Tử/ Thiết Bị Công Nghệ),Công Ty TNHH Tp-Link Technologies Việt Nam,Experienced (non-manager),0.0,0.0,0,Hồ Chí Minh,"Wireless Network, Technical Support, Excel, Key Account Management, Điện Tử Tiêu Dùng",,IT support,5
2039205,Technical Support - Raw Lubricants,"Brenntag Vietnam Co, Ltd",Experienced (non-manager),0.0,0.0,0,Hồ Chí Minh,"Industrial Lubricants, Oil and Gas Industry, Lubricants Knowledge, Chemical Sales, Application Portfolio Management",,IT support,5
2041587,"Service Engineer, Medical Technology",Carl Zeiss Vietnam Company Limited,Experienced (non-manager),0.0,0.0,0,Hồ Chí Minh,"Interpersonal Skills, Problem Solving, Teamwork, Technical Support, Troubleshooting",,IT support,5
2035105,Chuyên Viên Triển Khai & Vận Hành IoT (Technical Support),One Mount,Experienced (non-manager),0.0,0.0,0,Hà Nội,"MEP, Điện Tự Động Hóa, Điện tử, CAD, Cơ Điện Tử",,IT support,5
2010976,Technical Service Engineer - Chemical/PCB/FPCB Mandarin/English Speaker,"MacDermid Performance Solutions Co., LTD.",Fresher/Entry level,0.0,0.0,0,Hà Nội,"Communication, Electronics, PCB, Technical Support",,IT support,4
2041043,Kỹ Sư Hỗ Trợ Kỹ Thuật Trạm Sạc và Tủ Đổi Pin,Vinfast Global,Experienced (non-manager),0.0,0.0,0,Hồ Chí Minh,"Charging System, Vendor Audit, Technical Support, Electrical Power System, Vendor Quality Management",,IT support,5
2040671,Field Service Representative (Chemical / Water Treatment),Công Ty TNHH Ecolab Việt Nam,Experienced (non-manager),0.0,0.0,0,Hà Nội,"Chemical Engineering, Water Treatment, Field Service Engineer, Technical Support, Hóa Chất",,IT support,5
2037265,Technical Service Representative (TSR),PPG Vietnam,Experienced (non-manager),0.0,0.0,0,Hồ Chí Minh,"Customer Support, Customer Service, Technical Service, Coating, Technical Support",,IT support,5
2050601,Seaonics Warranty Coordinator,VARD Vung Tau Limited,Experienced (non-manager),0.0,0.0,0,Hồ Chí Minh,"Claims Handling, Claims Management, Customer Service, Technical Support, Warranty Coordination",,IT support,5
2044984,Chemical Engineering/ Hỗ Trợ Kỹ Thuật,"Lautan Luas Vietnam Co., Ltd.",Experienced (non-manager),0.0,0.0,0,Hà Nội,"Technical, Hóa Chất, Technical Engineering, Chemical Engineering, Technical Support",,IT support,5
2050388,Field Service Engineer,CÔNG TY TNHH RAY VINA,Experienced (non-manager),0.0,0.0,0,Hồ Chí Minh,"Technical Support, Biomedical Engineering, Field Services, Korean, Medical Device",,IT support,5
2047571,Technical Sales Support/ Proposal Engineer,Hai Phong Industrial Technology JSC (Hapco),Experienced (non-manager),0.0,0.0,0,Hà Nội,"Tự Động Hóa, Bán Hàng Kỹ Thuật, Oil and Gas Industry, Instrument Control, Industrial Automation",,IT support,5
2050101,Chuyên Gia – Quản Trị Công Ty,Công Ty Cổ Phần Vàng Bạc Đá Quý Phú Nhuận (PNJ),Experienced (non-manager),0.0,0.0,0,Hồ Chí Minh,"Giao Tiếp, Phân Tích Thông Tin, Pháp Chế Doanh Nghiệp, Quản Trị Mạng Công Ty, Soạn Báo Cáo",,IT support,5
2037597,[Tuyển Gấp] Technical Sales Engineer,"Goshu Kohsan (Vietnam) Co., Ltd.",Experienced (non-manager),0.0,0.0,0,Hà Nội,"Chemistry, Business Development, Chemical Selling, Technical Support, Customer Development",,IT support,5
2049731,EU IC Engineer QA,Seoul Semiconductor Vina,Fresher/Entry level,0.0,0.0,0,Hà Nam,"Technical Support, Customer Support, Quality Engineer, QA, English",,IT support,5
2023526,Machinery & Pipe Engineer,VARD Vung Tau Limited,Fresher/Entry level,0.0,0.0,0,Hồ Chí Minh,"English, Heavy Industry, ISO, Piping System, Technical Support",,IT support,5
2023525,Seaonics Mechanical Engineer,VARD Vung Tau Limited,Experienced (non-manager),0.0,0.0,0,Hồ Chí Minh,"Continuous Improvement, English, MS Office, Quality Control, Technical Support",,IT support,5
2023524,Hull & Outfitting Engineer,VARD Vung Tau Limited,Fresher/Entry level,0.0,0.0,0,Hồ Chí Minh,"ISO, Production Support, Quality Assurance, Technical Drawing, Technical Support",,IT support,5
2023521,HVAC & Accommodation Engineer,VARD Vung Tau Limited,Experienced (non-manager),0.0,0.0,0,Hồ Chí Minh,"Document Management, ISO, Production Support, Quality Assurance, Technical Support",,IT support,5
2023535,Seaonics Electrical And Automation Engineer,VARD Vung Tau Limited,Fresher/Entry level,0.0,0.0,0,Hồ Chí Minh,"Analytical Skills, Control System, Customer Relations, English, Technical Support",,IT support,5
2039055,Nhân Viên Thiêt Kế Mẫu / Pattern Design Làm Tại Hải Dương,Mascot International Viet Nam,Experienced (non-manager),0.0,0.0,0,Hải Dương,"Pattern Design, Gerber AccuMark, Kỹ Thuật May Mẫu, Technical Support, Thiết Kế Rập",,IT support,5
2043035,Technical / Field Services Engineer (Industrial Oil),Totalenergies,Experienced (non-manager),0.0,0.0,0,Hồ Chí Minh,"Technical Service, Technical Sales Support, Industrial Lubricants, Mechanical, Service Quality Control",,IT support,5
2048219,Nhân Viên Kỹ Thuật Văn Phòng (PM),CÔNG TY TNHH CÔNG NGHỆ CAO ELECTRIC BIRD,Experienced (non-manager),0.0,0.0,0,Hồ Chí Minh,"SCADA, Technical Operations, Monitoring System, Technical Support, Solar Power",,IT support,5
2046140,Structural Engineer,APPLIED RESEARCH CONSULTANTS VIETNAM COMPANY LIMITED,Experienced (non-manager),0.0,0.0,0,Hồ Chí Minh,"AutoCAD, BIM Model, Steel Structure, Structural Analysis, Technical Support",,IT support,5
2028420,Automation Engineer - Kỹ Sư Tự Động Hóa (Hà Nội),Công Ty TNHH Standard Units Supply Việt Nam,Experienced (non-manager),0.0,0.0,0,Hà Nội,"Technical Support Engineering, Intermediate level in English, Industrial Robots, Electric Actuators, Electronics",,IT support,5
2045467,"Bán Hàng Kỹ Thuật (Ngành Ăn Mòn, Thiết Bị & Hóa Chất Công Nghiệp)",JST,Fresher/Entry level,0.0,0.0,0,Hồ Chí Minh,"Customer Experience Management, Sales Development, Bán Hàng Kỹ Thuật, Technical Support, Tư Vấn Bán Hàng",,IT support,5
2026393,Field Service Engineer (Cleanroom/ Semiconductor),CÔNG TY TNHH THƯƠNG MẠI DỊCH VỤ AMORS,Experienced (non-manager),0.0,0.0,0,Bắc Ninh,"Technical Support, Clean Room Design, Basic Korean, Equipment Engineer, Field Service Engineering",,IT support,5
2042294,Sales Manager - Polymers,"GME Chemicals (Viet Nam) Co., Ltd.",Manager,0.0,0.0,0,Hồ Chí Minh,"English, Business Development, Polymer Processing, Customer Contact, Technical Sales Support",,IT support,5
2047267,Mechanical Technical Support (Machine Design),Navigos Search's Client,Experienced (non-manager),0.0,0.0,0,Hồ Chí Minh,"Technical Support, Mechanical Product Design, Machine Design",,IT support,3
2047255,Electrical Technical Support (Machine Design),Navigos Search's Client,Experienced (non-manager),0.0,0.0,0,Unknown,"Technical Support, Electric & Electronic Technical Support, Machine Design",,IT support,3
2045823,Admin Tiếng Trung,Quantel Global Vietnam Co. Ltd,Fresher/Entry level,0.0,0.0,0,Hải Phòng,"English, Quotation Preparation, Semiconductor, Technical Service, Technical Support",,IT support,5
2040167,Digital Marketing Executive (App/ Sports) - Senior Level,Hongkong Xinxin AI Technology LTD,Experienced (non-manager),0.0,0.0,0,Hà Nội,"Digital Marketing, Campaign Management, Growth Marketing, App Marketing, Mobile App Framework",,IT support,5
2043924,Giám Đốc CNTT,Công Ty Cổ Phần Tập Đoàn Đầu Tư Hoàng Gia Việt Nam,Director and above,0.0,0.0,0,Hồ Chí Minh,"Công Nghệ, Phát Triển Ứng Dụng Web, Chuyển Đổi Số, IT Operations, IT Project Management",,IT support,5
2043856,Technical Sales/Service Engineer (Chemical/KCN Amata),CÔNG TY TNHH AUROMEX VIỆT NAM,Experienced (non-manager),0.0,0.0,0,Đồng Nai,"Sales Strategy, Technical Service Experience, Chemical, Technical Support, Plating",,IT support,5
2043513,Dịch Vụ Khách Hàng,Công Ty TNHH Taxsee Việt Nam,Fresher/Entry level,0.0,0.0,0,Khánh Hòa,"Sales, Customer Service, Marketing, Customer Relations, Promotional Campaigns",,IT support,5
2042511,Trưởng Bộ Phận Bảo Mật & An Toàn Thông Tin,Công Ty CP Dây Cáp Điện Việt Nam - Cadivi,Manager,0.0,0.0,0,Hồ Chí Minh,"Công Nghệ Thông Tin, An Ninh Mạng, Bảo mật thông tin",,IT support,3
2042248,Kỹ Sư/ Chuyên Viên Phân Tích Nghiệp Vụ (Business Analyst),Viettel IT Center (VIC),Experienced (non-manager),0.0,0.0,0,Hà Nội,"Phân tích nghiệp vụ, Mô Hình Hóa Nghiệp Vụ",,IT support,2
2041203,IT Service Desk,Shinhan Vietnam Finance Company Limited,Experienced (non-manager),0.0,0.0,0,Hồ Chí Minh,"IT Helpdesk, IT Support, File Server, LAN",,IT support,4
2039380,Nhân Viên Mua Hàng Quốc Tế,Công ty cổ phần công nghệ Nessar Việt Nam,Experienced (non-manager),0.0,0.0,0,Hà Nội,"Kế Hoạch Mua Hàng, Kiểm Tra Chứng Từ, Phát Triển Thị Trường, Quản Lý Nhà Cung Cấp, Thu Thập Báo Giá",,IT support,5
2039484,Nhân Viên Hành Chính Nhân Sự,Công ty cổ phần công nghệ Nessar Việt Nam,Experienced (non-manager),0.0,0.0,0,Hà Nội,"HR Admin, IT Recruitment, Phỏng Vấn Tuyển Dụng, Tìm Kiếm Ứng Viên, Tuyển Dụng",,IT support,5
2039938,IT Staff / Executive,Bank of India - Ho Chi Minh City Branch,Experienced (non-manager),0.0,0.0,0,Hồ Chí Minh,"Information Technology, Core Banking, IT Helpdesk, IT Management",,IT support,4
2036159,Service Engineer & Technical Support in Food and Beverage Industry,Vietnamworks' Client,Experienced (non-manager),0.0,0.0,0,Hồ Chí Minh,"Service Engineering, Technical Support, Electronics, Cơ Khí Thiết Bị, Cơ Điện Tự Động",,IT support,5
2039766,Nhân Viên IT,Công ty TNHH Vico,Experienced (non-manager),0.0,0.0,0,Hải Phòng,"Dựng Video, IT Support",,IT support,2
2039305,Cán Bộ Hỗ Trợ Kinh Doanh,Công ty cổ phần công nghệ Nessar Việt Nam,Experienced (non-manager),0.0,0.0,0,Hà Nội,"Quản Trị Dự Án, Project Management, Sales Support, Kinh Doanh Dự Án, Project Monitoring",,IT support,5
2019132,Trưởng Phòng Công Nghệ Thông Tin,Công Ty Cổ Phần Dược Phẩm Vĩnh Phúc,Manager,0.0,0.0,0,Vĩnh Phúc,"IT System Administration, IT Management, IT Operations, SAP",,IT support,4
2039273,Senior IT Executive (Salary Range from Usd1.200 to 1.500),Vietnam International Township Development Jsc - ParkCity Hanoi,Experienced (non-manager),0.0,0.0,0,Hà Nội,"IT Helpdesk, IT Administration, IT Risk Management, IT Support",,IT support,4
2035015,Account Manager,Công Ty TNHH Viettel - CHT (Viettel Idc),Experienced (non-manager),0.0,0.0,0,Hà Nội,"Kế Hoạch Bán Hàng, Kinh Doanh, Technical Sales, Technical Consulting",,IT support,4
2038622,Technical Support (Không Yêu Cầu Kinh Nghiệm - Tiếng Trung Cơ Bản),"Zhejiang Uniview Technologies Co.,Ltd",Experienced (non-manager),0.0,0.0,0,Hồ Chí Minh,"Presales Technical, Hỗ Trợ Kỹ Thuật, Tự Động Hóa, Điện tử, Điện Tử Viễn Thông",,IT support,5
2038143,Nhân Viên IT Phụ Trách Bảo Mật Thông Tin Thuộc Bộ Phận Kiểm Soát Nội Bộ,"Công ty AUREOLE EXPERT INTEGRATORS Inc. thuộc tập đoàn Mitani Sangyo Co., Ltd. (Nhật Bản)",Experienced (non-manager),0.0,0.0,0,Hồ Chí Minh,"An Toàn Thông Tin, Cyber Security, ISO 27001, IT Security, Network Security",,IT support,5
2037756,Junior UI/UX Designer,CODEFORCE VINA,Experienced (non-manager),0.0,0.0,0,Hồ Chí Minh,"Figma, Adobe XD, UI/UX Design, Responsive Design, Sketch",,IT support,5
2033817,Application Engineer (Mechanical Design),Công Ty TNHH Seacad Technologies Vietnam,Experienced (non-manager),0.0,0.0,0,Hồ Chí Minh,"Mechanical Engineering, SolidWorks, CAE, Technical Support, Product Design",,IT support,5
2037494,Field Technical Support Engineer (Technical Consultancy),IFM Electronic Việt Nam,Experienced (non-manager),0.0,0.0,0,Hà Nội,"Consultant, Electric & Electronic Technical Support, Industrial Automation, PLC, Sensor Knowledge",,IT support,5
2037088,HR Supervisor / 人力资源主管,Công Ty Cổ Phần Xuân Cầu Holdings,Experienced (non-manager),0.0,0.0,0,Hà Nội,"Nhân Sự, HR, Quản Trị Nhân Sự, Tuyển Dụng, HR Recruitment",,IT support,5
2036842,IT Network Administrator,Công Ty TNHH Sản Xuất First Solar Việt Nam,Experienced (non-manager),0.0,0.0,0,Hồ Chí Minh,"IT Hardware, Network Administration, Firewall",,IT support,3
2036475,Customer Service Coordinator (Industrial Machinery),Navigos Search's Client,Experienced (non-manager),0.0,0.0,0,Hà Nội,"Mechanical Engineering, Customer Service, Project Coordination, Technical Support, English Fluency",,IT support,5
2036224,Chuyên Viên Cao Cấp Mua Sắm (Công Nghệ Thông Tin),Công Ty Cổ Phần Chứng Khoán SSI,Experienced (non-manager),0.0,0.0,0,Hà Nội,"Mua Sắm Tài Sản, Purchasing, Procument Skill, Supply Chain, Mua Hàng",,IT support,5
2035981,Nhân Viên IT Phần Cứng,Công Ty TNHH Điện Tử UMC Việt Nam,Experienced (non-manager),0.0,0.0,0,Bắc Ninh,"Tiếng Anh, Mua Hàng, Làm Báo Giá Hợp Đồng",,IT support,3
2035603,"Application/ Process Engineer (Wastewater, Waste Treatment, Renewable Energy)",CÔNG TY TNHH ANAERGIA VIETNAM,Fresher/Entry level,0.0,0.0,0,Hồ Chí Minh,"Wastewater Treatment, AutoCAD, System Design, Technical Support",,IT support,4
2035222,Nhân Viên Kỹ Thuật (Thu Nhập Lên Tới 20 Triệu/tháng),Công ty TNHH Bảo Dưỡng Toàn Cầu,Experienced (non-manager),0.0,0.0,0,Hồ Chí Minh,"ATM Maintenance, Bảo Trì Máy, Sửa Chữa Thiết Bị, Xử Lý Sự Cố, Điện Tử Viễn Thông",,IT support,5
2034974,Chuyên Viên Hỗ Trợ Kinh Doanh (Sales Support),Công Ty Cổ Phần Netnam,Experienced (non-manager),0.0,0.0,0,Hà Nội,"Quản Trị Kinh Doanh, Tin Học Văn Phòng, Hỗ Trợ Kinh Doanh, Sales Admin, Sales Support",,IT support,5
2034727,Infra Administrator And Helpdesk,Fushan Technology Vietnam,Experienced (non-manager),0.0,0.0,0,Bắc Ninh,"Network, Problem-solving, System Administration, Technical Support, Windows Server",,IT support,5
2033813,It Helpdesk Engineer,EMASI Plus Waterpoint,Fresher/Entry level,0.0,0.0,0,Long An,"Technical Support, Software Troubleshooting, Microsoft Office 365, PC Hardware, Interpersonal skills",,IT support,5
1916525,IT Helpdesk,Olam Global Agri Việt Nam,Experienced (non-manager),0.0,0.0,0,Long An,"IT Helpdesk, Công Nghệ Thông Tin, Technical Support, IT System Administration, IT Hardware",,IT support,5
2022376,Trợ Lý Kỹ Thuật / Technical Assistant - Thu Nhập Lên Tới 20 Triệu,Vina-Sanwa Company Liability Limited,Experienced (non-manager),0.0,0.0,0,Quảng Ninh,"Trợ Lý, Technical Administration, Technical, Administrative, Kế Toán",,technical support,5
2046923,Kỹ Sư Ứng Dụng Kỹ Thuật FAE (Hỗ Trợ Kỹ Thuật Cho Khách Hàng) - NHẬN VIỆC NGAY,Công Ty TNHH Điện Khí Quốc Quang (Việt Nam)- GGEC,Experienced (non-manager),0.0,0.0,0,Quảng Nam,"Hỗ Trợ Kỹ Thuật, Điện Tử Viễn Thông, Tự Động Hóa, Giao Tiếp",,technical support,4
2046599,Kiến Trúc Sư Thiết Kế Ánh Sáng,Công Ty CP Giải Pháp Ánh Sáng Alis Lighting,Fresher/Entry level,0.0,0.0,0,Hà Nội,"Thiết Kế Hệ Thống, AutoCAD, Giám Sát Thi Công, Hỗ Trợ Kỹ Thuật, Thiết Kế Kiến Trúc",,technical support,5
2023416,Nhân Viên Hỗ Trợ Kỹ Thuật,Arcstone Operations Platform,Experienced (non-manager),0.0,0.0,0,Hà Nội,"Hỗ Trợ Kỹ Thuật, PCB, PCB Application, Tự Động Hóa, Điện tử",,technical support,5
2035137,Nhân Viên Admin Tổng Hợp,Công Ty Cổ Phần Thương Mại Tràng An- Việt Nam,Experienced (non-manager),0.0,0.0,0,Hà Nội,"Excel/Word Proficiency, Hỗ Trợ Kỹ Thuật, Quản Lý Dữ Liệu, Quản Trị Bán Hàng, Admin",,technical support,5
2045963,Kỹ Sư Dịch Vụ (Service Engineer) - Lương 400-800 USD,"Techno Vietnam Industries Co., Ltd.",Fresher/Entry level,0.0,0.0,0,Hà Nội,"Tiếng Anh, Hỗ Trợ Kỹ Thuật, Tư Vấn Giải Pháp, Sửa Chữa, Lắp Đặt",,technical support,5
2037997,Kỹ Sư Hỗ Trợ Kỹ Thuật,Chi Nhánh Hà Nội - Công Ty Cồ Phần Daikin Air Conditioning (Vietnam),Experienced (non-manager),0.0,0.0,0,Hà Nội,"HVAC System, Hỗ Trợ Kỹ Thuật, Hvac Engineering, Construction Project, Refrigeration",,technical support,5
2047395,Technical Sales Assistant,Công Ty TNHH Thang Máy VGSI,Experienced (non-manager),0.0,0.0,0,Hà Nội,"Attention To Detail, Autocad, Design Software, Good English Skills, Zwcad",,technical support,5
2049181,Asisstant Sales Manager (Ha Noi/ Hai Phong),Công Ty TNHH KSMC,Experienced (non-manager),0.0,0.0,0,Hà Nội,"Bán Hàng Kỹ Thuật, Quản Lý Khách Hàng, Hỗ Trợ Kỹ Thuật, Kinh Doanh Hóa Chất, Sales Assistant Manager",,technical support,5
2033665,Trưởng Bộ Phận Kinh Doanh,Công Ty Cổ Phần Cơ Khí Chính Xác Smart Việt Nam,Manager,0.0,0.0,0,Hà Nội,"Gia Công Kim Loại, Hỗ Trợ Kỹ Thuật, Phân Tích Thị Trường, Quản Lý Bán Hàng, Quản Lý Đội Ngũ Kinh Doanh",,technical support,5
2041915,Kỹ Thuật Viên Vận Hành & Bảo Trì Hệ Thống – Môi Trường Giáo Dục Chuyên Nghiệp,Scotch Australian Grammar School (AGS),Experienced (non-manager),0.0,0.0,0,Hồ Chí Minh,"Quản Lý Thiết Bị, Sửa Chữa Thiết Bị, Hỗ Trợ Kỹ Thuật, Bảo Trì Hệ Thống, Điện Công Nghiệp",,technical support,5
2038540,Kỹ Sư Quản Lý Chất Lượng Nguyên Vật Liệu/ Sản Phẩm Đầu Vào (QA-IQC),"SEI Electronic Components (Vietnam), Ltd.",Fresher/Entry level,0.0,0.0,0,Hà Nội,"IQC, QA, Đánh Giá Chất Lượng, Cải Tiến Chất Lượng, Điện + Điện tử",,QA engineer,5
2047244,Kỹ Sư Quản Lý Chất Lượng (QA),"SEI Electronic Components (Vietnam), Ltd.",Experienced (non-manager),0.0,0.0,0,Hà Nội,"Quality Control, Kiểm Soát Chất Lượng, Cải Tiến Chất Lượng, 8D Report, 7QC Tools",,QA engineer,5
2046757,"QA Engineer (Kỹ Sư Chất Lượng, Tiếng Anh Thành Thạo )",Công Ty TNHH LG Innotek Việt Nam Hải Phòng,Experienced (non-manager),0.0,0.0,0,Hải Phòng,"Quality Assurance, Process Improvement, PQA, Quality Control, Đảm Bảo Chất Lượng",,QA engineer,5
2043289,[Hot Job] Tuyển Gấp 3 Kỹ Sư QA/QC (Upto 27 Triệu/tháng),Công ty Cổ phần Xây dựng Vilai Việt,Experienced (non-manager),0.0,0.0,0,Hà Nội,"Kiểm Soát Chất Lượng, Kỹ Thuật Công Trình, Đảm Bảo Chất Lượng, Xây Dựng, Thi Công Nhà Cao Tầng",,QA engineer,5
2024754,Kỹ Sư QA/QC (Ngành Xây Dựng) - Thu Nhập Upto 15-20Tr (SV Mới Ra Trường Được Đào Tạo),Công ty CP Xây dựng và Kỹ nghệ Intercontinental,Experienced (non-manager),0.0,0.0,0,Bắc Giang,"Kinh Tế Xây Dựng, Excel, AutoCAD, Bóc Tách Khối Lượng, Lập Hồ Sơ Thanh Toán",,QA engineer,5
2017865,QA-QC Engineer (Tiếng Anh Giao Tiếp),LG Electronics Việt Nam Hải Phòng,Fresher/Entry level,0.0,0.0,0,Hải Phòng,"Quality Assurance, Sampling Plan, Testing Process, Electronics, Mechanical",,QA engineer,5
2043197,Quality Assurance Engineer - Kỹ Sư Đảm Bảo Chất Lượng Ngành Điện Tử (Có Xe Đưa Đón Ở TP.HCM),CÔNG TY TNHH AMPHENOL TECHNOLOGY VIỆT NAM,Experienced (non-manager),0.0,0.0,0,Quốc tế,"Electrical Engineer, Npi Processes, Quality Control and Compliance, 7QC Tools, PPAP",,QA engineer,5
2022621,Kỹ Sư Quản Lý Chất Lượng (QA/QC),Công ty Cổ phần Đăng Việt E&C,Experienced (non-manager),0.0,0.0,0,Bình Dương,"Giám Sát Thi Công, Nghiệm Thu Khối Lượng, Quản Lý Công Trình Xây Dựng, Quản Lý Dự Án, Định Mức Vật Tư",,QA engineer,5
2035149,"Kỹ Sư QA/QC Thiết Bị Chế Tạo và Kết Cấu Thép (Tổ Hợp Thép, Hà Tĩnh)",Công Ty Cổ Phần Sản Xuất Và Kinh Doanh VinMetal,Experienced (non-manager),0.0,0.0,0,Hà Tĩnh,"Kết Cấu Thép, Cơ Khí, Công Nghiệp Nặng, Mechanical, Cơ Khí Chế Tạo",,QA engineer,5
2050616,Kỹ Sư QA QC,Công Ty Cổ Phần Mai Bá Hương Building,Experienced (non-manager),0.0,0.0,0,Long An,"QC, QA, Kiểm Soát Chất Lượng, Xây Dựng, AutoCAD",,QA engineer,5
2046477,Kỹ Sư Hệ Thống (Kỹ Sư QA),Công Ty TNHH Công Nghệ Và Chiếu Sáng NVC Việt Nam,Experienced (non-manager),0.0,0.0,0,Bắc Ninh,"ISO 9001, Kiểm Tra Chất Lượng, Quản Lý Chất Lượng, Quản Lý Sản Xuất, Tiếng Trung",,QA engineer,5
2048784,Quality Process Assurance Engineer,Airspeed Manufacturing Vietnam LLC,Experienced (non-manager),0.0,0.0,0,Long An,"QA experience, QA Engineering, QA/ QC, Qa/Qc Management, QA & Testing",,QA engineer,5
2045650,Quality Assurance Engineer (QA Engineer),"Spindex Industries (Hanoi) Co., Ltd",Experienced (non-manager),0.0,0.0,0,Hà Nội,"Quality Control, Audit, ISO, Equipment Measurement, Customer Negotiation",,QA engineer,5
2037966,Kỹ Sư QA - QC Dự Án (Ngành Xây Dựng - SL Gấp: 4 Khánh Hòa - 4 HCM),CÔNG TY CỔ PHẦN KỸ THUẬT XÂY DỰNG VELA,Experienced (non-manager),0.0,0.0,0,Hồ Chí Minh,"Kiểm Soát Chất Lượng, AutoCAD, Excel, Đọc Hiểu Bản Vẽ, Nghiệm Thu Công Trình",,QA engineer,5
2037410,Kỹ Sư Đảm Bảo Chất Lượng/ Quality Assurance Engineer,Công Ty Cổ Phần Phương Tiện Điện Thông Minh Selex,Experienced (non-manager),0.0,0.0,0,Hà Nội,"Đánh Giá Chất Lượng, Quality Assurance, QA, QC, Kiểm Soát Chất Lượng",,QA engineer,5
2038029,Kỹ Sư Quản Lý Chất Lượng QC-QA Engineer (Lương 25-30 Triệu) - Làm Việc Tại Thái Nguyên,"MDA E&C Co.,ltd",Experienced (non-manager),0.0,0.0,0,Thái Nguyên,"Lập Trình AutoCAD, Giám Sát Hiện Trường, Quality Control, Site Inspection, Xây Dựng Dân Dụng",,QA engineer,5
2037306,Urgent - Senior QA/QC Engineer,Công Ty TNHH Tư Vấn Xây Dựng Và Trang Trí Nội Thất Maestro (Việt Nam),Experienced (non-manager),0.0,0.0,0,Hồ Chí Minh,"Quản lý chất lượng, Kiểm Soát Chất Lượng, Xây Dựng, Qa/Qc Management, Construction Quality Management",,QA engineer,5
2037188,Kỹ Sư QC Tại Bắc Ninh,CHI NHÁNH CÔNG TY TNHH XÂY DỰNG VÀ ĐẦU TƯ THƯƠNG MẠI HỢP NHẤT VIỆT NAM,Experienced (non-manager),0.0,0.0,0,Bắc Ninh,"Quản Lý Dự Án, Kỹ sư QA/QC, Hồ Sơ Hoàn Công, Nghiệm thu công trình xây dựng, Xây Dựng",,QA engineer,5
