job_id,title,company,job_level,salary_min,salary_max,salary_text,location,skills,url,search_keyword,skill_count
2042238,Kỹ Sư IT Điện Tử Viễn Thông (Upto 16 Triệu),Công Ty TNHH Thép Hòa Phát Hưng Yên,Experienced (non-manager),0.0,0.0,0,Hưng Yên,"Cấu Hình Mạng, IT Support, IT System, IT Helpdesk, Network Configuration",,information technology,5
2012152,Chuyên Viên Quản Trị Hệ Thống,Phenikaa Group,Experienced (non-manager),0.0,0.0,0,Hà Nội,"An Toàn Thông Tin, IT System Administration, IT Security, Quản Trị Hệ Thống, Bảo Mật Hệ Thống",,information technology,5
2041952,Chuyên Viên Quản Lý Dự Án Hạ Tầng CNTT (PM) - Mã Số: Vhqt - 05,Chi Nhánh Trung Tâm Công Nghệ Thông Tin Tập Đoàn Bảo Việt,Experienced (non-manager),0.0,0.0,0,Hà Nội,"Project Management, PM, Quản Lý Dự Án Công Nghệ, PMP, Đấu Thầu",,information technology,5
2041625,Trưởng Bộ Phận Kế Hoạch Vận Hành Delivery,GSM,Manager,0.0,0.0,0,Hà Nội,"Phân Tích Kinh Doanh, Vận Hành Kinh Doanh, Tối Ưu Hệ Thống, Delivery Service",,information technology,4
2041585,Data Governance & Master Data Management Supervisor,Anheuser- Busch Inbev (AB Inbev),Experienced (non-manager),0.0,0.0,0,Hồ Chí Minh,"Excel Proficiency, Master Data Management, Problem-solving, SAP, Strategy Mapping",,information technology,5
2041501,Lập Trình Viên Python,Tập Đoàn Bưu Chính Viễn Thông Việt Nam (VNPT),Experienced (non-manager),0.0,0.0,0,Hà Nội,"ASP.NET, English Reading, HTML/CSS, Java, Python",,information technology,5
2041466,Kỹ Sư Lập Trình Web Frontend,Tập Đoàn Bưu Chính Viễn Thông Việt Nam (VNPT),Experienced (non-manager),0.0,0.0,0,Hà Nội,"CSS3, HTML5, JavaScript, Lập Trình C++, Phát Triển Ứng Dụng Web",,information technology,5
2041462,Lập Trình Viên Java,Tập Đoàn Bưu Chính Viễn Thông Việt Nam (VNPT),Experienced (non-manager),0.0,0.0,0,Hà Nội,"JSP, Spring Framework, HTML",,information technology,3
2041198,Senior Office Admin (English Or Chinese),ITECHWX COMPANY LIMITED,Experienced (non-manager),0.0,0.0,0,Hồ Chí Minh,"Admin, Administrative Support, Business Administration, English & Chinese, Chinese",,information technology,5
2040579,[Junior Up - Level] Full-Stack Software Engineer (Web),MCGAAW,Experienced (non-manager),0.0,0.0,0,Hồ Chí Minh,"JavaScript, Golang, SQL, Typescript, FullStack",,information technology,5
2022880,Senior HR Executive,FUJIFILM Business Innovation Vietnam,Experienced (non-manager),0.0,0.0,0,Hà Nội,"Cultural sensitivities, Good English Skills, Interpersonal Skills, Microsoft Office, Recruitment",,information technology,5
2040155,Personal Assistant (Fluent in both Chinese & English),ITECHWX COMPANY LIMITED,Experienced (non-manager),0.0,0.0,0,Hồ Chí Minh,"Logistics Management, Office Administration, Business Administration, General Administration, Travel Arrangement",,information technology,5
2040159,IT Support Engineer (English Speaking - Open for Fresher),ITECHWX COMPANY LIMITED,Experienced (non-manager),0.0,0.0,0,Hồ Chí Minh,"Windows Server, Network, Problem Solving, English, IT Support",,information technology,5
2040165,IT Lead (English Fluency - AI Driven),ITECHWX COMPANY LIMITED,Experienced (non-manager),0.0,0.0,0,Hồ Chí Minh,"Operations Management, Information Security, AI application, Cloud Platform, General Communication English",,information technology,5
2036235,Chief Accountant cum HR,Wecloud JSC,Manager,0.0,0.0,0,Hồ Chí Minh,"Accounting Law, CPA, Account Management, Financial Control, HR Policies",,information technology,5
2039916,Sales Support (Ha Noi),Công Ty TNHH Airquay Vina,Experienced (non-manager),0.0,0.0,0,Hà Nội,"Purchasing, Market Research, Cost Management, Supplier Relationship Management",,information technology,4
2039657,[Hà Nội/Hồ Chí Minh] CV/CVC/CVCC Kỹ thuật Dữ liệu (DE),Ngân hàng Lộc Phát Việt Nam LPBank,Experienced (non-manager),0.0,0.0,0,Hà Nội,"Azure Data Services, ETL, Khai Thác Dữ Liệu, Phân Tích Dữ Liệu, Quản Trị Dữ Liệu",,information technology,5
2039634,[Hồ Chí Minh] CVC/CVCC Vận hành Cơ sở Dữ liệu,Ngân hàng Lộc Phát Việt Nam LPBank,Experienced (non-manager),0.0,0.0,0,Hồ Chí Minh,"CSDL Oracle, MariaDB, PostgreSQL, Quản Trị Hệ Thống, SQL Server",,information technology,5
2039442,"Quality Assurance (Fixed nightshift, open for candidates with CS experience)",ITECHWX COMPANY LIMITED,Experienced (non-manager),0.0,0.0,0,Hồ Chí Minh,"BPO, Customer Service Mindset, English Language Proficiency, Night Shift Availability, Quality Assurance",,information technology,5
2019305,Solution Presales,FUJIFILM Business Innovation Vietnam,Experienced (non-manager),0.0,0.0,0,Hồ Chí Minh,"Project Management, Communication Skills, Solution Design, Oracle CRM, Manage ERP Software",,information technology,5
2038862,Nhân Viên IT (IT Business Analyst),Công Ty TNHH Dainese Việt Nam,Experienced (non-manager),0.0,0.0,0,Thái Nguyên,"English Communication, Network Management, Technical Support, Utility Maintenance",,information technology,4
2011735,Chuyên Gia Chuyển Đổi Số Khách Hàng Doanh Nghiệp Lớn - Trung Tâm Khách Hàng Doanh Nghiệp Lớn - Khối Khách Hàng Doanh Nghiệp,Ngân Hàng TMCP Quốc Dân ( NCB ),Experienced (non-manager),0.0,0.0,0,Hà Nội,"Tín Dụng Doanh Nghiệp, Phát Triển Sản Phẩm, Chuyển Đổi Số, Bán hàng, Core Banking",,information technology,5
2017782,Phụ Trách Vận Hành Chuỗi Cửa Hàng Bách Hóa Bưu Điện,Tổng Công Ty Bưu Điện Việt Nam - VNPOST,Manager,0.0,0.0,0,Hà Nội,"Kinh doanh dịch vụ CNTT, Quản Trị Đội Ngũ, Xây Dựng Chiến Lược, Phát Triển Kinh Doanh, Phát Triển Kinh Doanh Bán Lẻ",,information technology,5
2037388,Junior Software Engineer,Random Order,Fresher/Entry level,0.0,0.0,0,Quốc tế,"Back-end Programming, Database Design, Frontend development, Full Stack Development",,information technology,4
2037098,Automotive Content Creator,MCGAAW,Experienced (non-manager),0.0,0.0,0,Hồ Chí Minh,"Automotive, Video Editor, English, Technical Expertise",,information technology,4
2034618,Technical Support Engineer (English Speaking - Upto 22M),ITECHWX COMPANY LIMITED,Experienced (non-manager),0.0,0.0,0,Hồ Chí Minh,"Customer Service, Problem-solving, Analytical Skills, English, It Background",,information technology,5
2034605,Nightshift Technical Support (English Speaking - Upto 22M),ITECHWX COMPANY LIMITED,Fresher/Entry level,0.0,0.0,0,Hồ Chí Minh,"Analytical Skills, Customer Service, Empathy",,information technology,3
2036472,Trưởng Phòng Marketing,CÔNG TY CỔ PHẦN CÔNG NGHỆ OMNITECH HOLDINGS,Manager,0.0,0.0,0,Hà Nội,"Marketing Development, Quảng Cáo, Quan Hệ Công Chúng, Truyền Thông",,information technology,4
2036316,Research and Teaching Assistant (RTA) in Business Analytics and Management Information Systems,VGU - Vietnamese German University,Experienced (non-manager),0.0,0.0,0,Bình Dương,"Business Informatics System, Computer Science, English Fluency, Research, Teaching",,information technology,5
2036242,Product Quality Engineer,Google,Experienced (non-manager),0.0,0.0,0,Hà Nội,"Electronics Manufacturing, Mandarin, Product Quality, Statistical Process Control, Design Of Experiments",,information technology,5
2034746,UI UX Designer,Công Ty Cổ Phần Bảo Hiểm Opes,Experienced (non-manager),0.0,0.0,0,Hà Nội,"Adobe Creative Suite, Figma, Project Management, UI/UX, UX Research",,information technology,5
2034479,L1 Desktop Support Engineer,CÔNG TY TNHH EXCIS VIETNAM LTD,Experienced (non-manager),0.0,0.0,0,Hà Nội,"Break/Fix Support, Communication Skills, Guest Request Handling, Incident Management, System Configuration",,information technology,5
2034412,Project Manager (Insurance Claims),MEDICONCEN LIMITED,Experienced (non-manager),0.0,0.0,0,Hồ Chí Minh,"Project Management, Business Analysis, Insurance Claims, Digitalization, Stakeholder Management",,information technology,5
2034391,[Hà Nội] CV/CVC/CVCC Quản trị Dữ liệu Tài chính - Khối Tài chính,Ngân hàng TMCP Tiên Phong (TPBank),Experienced (non-manager),0.0,0.0,0,Hà Nội,"Cơ Sở Dữ Liệu, Data Warehouse, Oracle SQL, Power BI, Qlik Sense",,information technology,5
2034078,IT Service Engineer (Healthcare),Konica Minolta Business SOLUTIONS VN,Manager,0.0,0.0,0,Hồ Chí Minh,"Healthcare System, Server Configuration, Network Configuration, Database Software, Problem-solving",,information technology,5
2016646,Phó Trưởng Phòng Kinh Doanh (Dịch Vụ CNTT),Tổng Công Ty Bưu Điện Việt Nam - VNPOST,Manager,0.0,0.0,0,Hà Nội,"Giao Tiếp, Lãnh Đạo, Quản Trị Đội Ngũ, Xây Dựng Chiến Lược",,information technology,4
2014507,Nhân Viên Quản Lý Khách Hàng (AM) (Dịch Vụ CNTT),Tổng Công Ty Bưu Điện Việt Nam - VNPOST,Experienced (non-manager),0.0,0.0,0,Hà Nội,"Bán hàng, Công Nghệ Thông Tin, Giải Pháp Công Nghệ, Quản Lý Khách Hàng, Tìm Kiếm Khách Hàng",,information technology,5
2034004,Network Administrator,Tổng Công Ty Bưu Điện Việt Nam - VNPOST,Experienced (non-manager),0.0,0.0,0,Hà Nội,"Firewall, Network Security, Quản Trị Hệ Thống Mạng, Routing Protocol, Switch",,information technology,5
2033882,Middle/Senior .Net Developer,Công Ty Cổ Phần Chứng Khoán SSI,Experienced (non-manager),0.0,0.0,0,Hà Nội,".Net, C#, Entity Framework, SOLID Principle, OOP",,information technology,5
2033864,Data Architect Manager,HEINEKEN Vietnam,Manager,0.0,0.0,0,Hồ Chí Minh,"Data Architecture, Data Governance, Data Modeling, Cloud, Data Engineering",,information technology,5
2013903,Giám Đốc Khối Kinh Doanh,Công Ty Cổ Phần Tập Đoàn Meey Land,Director and above,0.0,0.0,0,Hà Nội,"Business Development Management, Chiến Lược Kinh Doanh, Marketing Campaign Management",,information technology,3
2041073,"Back-end Developer (Java, SQL, Spring, English,chinese)",Công Ty TNHH Clever Creations Tech,Experienced (non-manager),0.0,0.0,0,Hồ Chí Minh,"Java, API, Spring Framework, MySQL, REST",,information technology,5
2049949,Project Manager,CÔNG TY TNHH QUANOVA,Manager,0.0,0.0,0,Đà Nẵng,"Agile Methodologies, Communication, Project Coordination, Project Management, Self Planning",,information technology,5
2049965,Founding Operations Lead,CÔNG TY TNHH QUANOVA,Experienced (non-manager),0.0,0.0,0,Đà Nẵng,"Document Management, Friendly Communication, Operations Management, Productivity Analysis, Task Coordination",,information technology,5
2049976,Project Manager Assistant,CÔNG TY TNHH QUANOVA,Experienced (non-manager),0.0,0.0,0,Đà Nẵng,"Agile Methodologies, Communication Skills, Project Coordination, Project Management, Self Planning",,information technology,5
2041525,Junior Technical Support Engineer (Bess Battery Energy Storage System),CÔNG TY TNHH NĂNG LƯỢNG VIỆT NAM WOO,Fresher/Entry level,0.0,0.0,0,Hà Nội,"Technical Support, Electrical Systems, Microsoft Excel, Điện, Pre-sales",,information technology,5
2030975,Infrastructure Network Engineer,CÔNG TY TNHH DỆT REGENT VIỆT NAM,Experienced (non-manager),0.0,0.0,0,Phú Thọ,"English, Network Protocols, Security Control, System Support, Troubleshooting",,information technology,5
2050578,IT Project Manager,VIETNAM HOUSEWARES CORP,Experienced (non-manager),0.0,0.0,0,Bình Dương,"IT Project Management, Manage ERP Software, Business Process Design, Vendor Management, Communication Skills",,information technology,5
2041464,Lập Trình Viên NodeJS,Tập Đoàn Bưu Chính Viễn Thông Việt Nam (VNPT),Experienced (non-manager),0.0,0.0,0,Hà Nội,"Front-End, Node.js, Web API, Server-Side Template Language, Framework",,information technology,5
2041493,Kỹ Sư Devops,Tập Đoàn Bưu Chính Viễn Thông Việt Nam (VNPT),Experienced (non-manager),0.0,0.0,0,Hồ Chí Minh,"Ci/Cd Methodologies, Docker, Kubernetes, Linux, Prometheus",,information technology,5
2041481,Lập Trình Viên Mobile (Flutter),Tập Đoàn Bưu Chính Viễn Thông Việt Nam (VNPT),Experienced (non-manager),0.0,0.0,0,Hà Nội,"Dart, Flutter, Java, APIs",,information technology,4
2041488,Chuyên Viên Phân Tích Nghiệp Vụ (BA),Tập Đoàn Bưu Chính Viễn Thông Việt Nam (VNPT),Experienced (non-manager),0.0,0.0,0,Hà Nội,"Kiểm Tra Chất Lượng, Lập Trình, Thiết Kế Phần Mềm, Uml, URD",,information technology,5
2044971,Nhân Viên Mua Hàng,CÔNG TY CỔ PHẦN CÔNG NGHỆ PAVANA,Experienced (non-manager),0.0,0.0,0,Hà Nội,"Dự Toán Chi Phí, Quản Lý Ngân Sách, Quản Lý Tiến Độ, Thương Mại Quốc Tế, Tìm Kiếm Nhà Cung Cấp",,information technology,5
2050535,Senior Product Delivery Executive,Công Ty Tài Chính TNHH Ngân Hàng TMCP Sài Gòn - Hà Nội (Shbfinance),Experienced (non-manager),0.0,0.0,0,Hồ Chí Minh,"Product Analysis, Coordinator, User Experience, Customer Journey Map",,information technology,4
2050463,"Electrical/Automation Engineer - Kỹ Sư Điện, Tự Động Hóa",Fleming International Viet Nam,Experienced (non-manager),0.0,0.0,0,Đồng Nai,"Electrical System, PLC Programming, HMI programming, Problem Solving, Communication Skills",,information technology,5
2050504,Kỹ Sư Xây Dựng (Kỹ Sư Điện Nhẹ) (Từ 18-30Tr/tháng),Công Ty TNHH Công Nghệ Nguyên Lộc,Experienced (non-manager),0.0,0.0,0,Hà Nội,"Giám Sát Thi Công, Dự Toán Xây Dựng, Làm Hồ Sơ Thanh Quyết Toán, Bóc Tách Khối Lượng, Hồ Sơ Hoàn Công",,information technology,5
2041435,Digital Product Manager,"KFC Vietnam Joint Venture Co., Ltd.",Experienced (non-manager),0.0,0.0,0,Hồ Chí Minh,"Agile Methodology, Communication Skills, Product Management, Project Management, Requirement Analysis",,information technology,5
2050449,System Administrator,VGU - Vietnamese German University,Experienced (non-manager),0.0,0.0,0,Bình Dương,"Analytical Skills, Linux System Administration, SQL Server, VMware vSphere, Windows Server",,information technology,5
2050436,Network Administrator,VGU - Vietnamese German University,Experienced (non-manager),0.0,0.0,0,Bình Dương,"Communication Skills, Network Configuration, Network Security, Routine Maintenance, User Support",,information technology,5
2050059,IT Executive - Chuyên Viên IT,Linea Aqua Vietnam Company Limited (Lavn),Experienced (non-manager),0.0,0.0,0,Hưng Yên,"IT System Administration, System Administration, IT Infrastructure Management, IT Production",,information technology,4
2041326,Project Manager,Công Ty TNHH Premo Việt Nam,Manager,0.0,0.0,0,Quảng Nam,"Gantt Chart, IT Knowledge, Problem Solving, Project Management, SAP",,information technology,5
2050384,Kỹ Sư Phần Mềm (Software Engineering) - Làm Việc Tại Bắc Ninh,Công Ty TNHH Cresyn Hà Nội - Nhà Máy Bắc Ninh,Experienced (non-manager),0.0,0.0,0,Bắc Ninh,"C++, C#, Java, .NET, Lập Trình",,information technology,5
2050338,Tuyển Dụng Leader Build Up & Vận Hành Store,Công Ty Cổ Phần Green Leaf Holding,Experienced (non-manager),0.0,0.0,0,Hà Nội,"PrestaShop, WooCommerce, Code Wordpress, Shopify, Store Operation",,information technology,5
2050345,Corder/AI Automation Developer,Công Ty Cổ Phần Green Leaf Holding,Experienced (non-manager),0.0,0.0,0,Hà Nội,"JavaScript, Python, API Integration, ESS Tools, AI",,information technology,5
2050316,Trưởng Phòng Pháp Chế,Công Ty Cổ Phần Công Nghệ Sapo,Manager,0.0,0.0,0,Hà Nội,"Am Hiểu Pháp Luật, Kiểm Soát Rủi Ro, Pháp Chế Doanh Nghiệp, Tư Vấn Pháp Lý, Văn Bản Pháp Chế",,information technology,5
2050306,IT Specialist (Location: Thu Duc & D3),CÔNG TY TNHH PHÒNG THỬ NGHIỆM HOHENSTEIN VIETNAM,Experienced (non-manager),0.0,0.0,0,Hồ Chí Minh,"Helpdesk, IT Infrastructure Management, Server Management, Troubleshooting, User administration",,information technology,5
2050304,Creative & Design Intern,Công Ty TNHH Tư Vấn NDH,Intern/Student,0.0,0.0,0,Hà Nội,"Branding, Creativity, Graphic Design, Marketing Development, Multimedia",,information technology,5
2050290,Nhân Viên IT,"Kortek Vina Co., Ltd",Experienced (non-manager),0.0,0.0,0,Hà Nam,"IT Management, Technical Support, Computer Skills, Network Technology, Problem Solving",,information technology,5
2050264,Thực Tập Sinh Công Nghệ Thông Tin Fulltime Có Lương Và Có Mộc,Công Ty Công Nghệ Phần Mềm Nasani,Intern/Student,0.0,0.0,0,Hồ Chí Minh,"Công Nghệ Thông Tin, phần mềm thiết kế, Website Design Consulting, business analyst, Tư Vấn",,information technology,5
2045025,Kế Toán Tổng Hợp (Trung Gian Thanh Toán),Công Ty Cổ Phần Hệ Thống Công Nghệ ETC,Experienced (non-manager),0.0,0.0,0,Hà Nội,"Tiếng Anh, Kế Toán Tổng Hợp, General Accounting Principals, General Accounting, Kế Toán",,information technology,5
2047952,IT Coordinator Cum IT Comtor (Korean - Speaking),Korea Development Bank Hanoi Branch,Experienced (non-manager),0.0,0.0,0,Hà Nội,"IT Administration, IT Operations, Korean Speaking Skill, MES System Management, Stakeholder Coordination",,information technology,5
2047505,Kỹ Sư Giải Pháp CNTT / Presale Kỹ Thuật,Công Ty Đầu Tư Và Công Nghệ DHA,Experienced (non-manager),0.0,0.0,0,Hà Nội,"Giải Pháp Cải Tiến, An Toàn Thông Tin, Quản Trị Mạng Máy Tính, Nghiên Cứu Tài Liệu, Presales Technical",,information technology,5
2045775,Senior Associate - Salesforce Business Analyst (Consulting),PwC (Vietnam) Ltd.,Experienced (non-manager),0.0,0.0,0,Hà Nội,"Salesforce, Tư Vấn, Công Nghệ Thông Tin",,information technology,3
2047676,Giáo Viên Bộ Tin học (Trung học),Hệ Thống Giáo Dục Archimedes School,Experienced (non-manager),0.0,0.0,0,Hà Nội,"Giáo Dục, Kỹ Năng Sư Phạm, Đào Tạo, Công Nghệ Thông Tin, Tin Học",,information technology,5
2047500,Giám Đốc Dự Án (MEPF) / Project Manager (MEPF),Công Ty Cổ Phần Cơ Điện Himep Https://himep-Asia.com/,Director and above,0.0,0.0,0,Hà Nội,"It, Project Management, MEPF, Quản Lý Hợp Đồng, Leadership",,information technology,5
2047073,Chuyên viên Tư vấn giải pháp (Presales),Công Ty Cổ phần Tin Học – Viễn Thông Hàng Không ( AITS),Experienced (non-manager),0.0,0.0,0,Hà Nội,"Giao Tiếp  Và Thuyết Phục, Đấu Thầu",,information technology,2
2021342,Embedded Software Developer (AUTOSAR Classic) (1 Year contract),Bosch Global Software Technologies Company Limited,Experienced (non-manager),0.0,0.0,0,Hồ Chí Minh,"Embedded, Embedded Testing, Component Testing, System Testing",,information technology,4
2047804,Kỹ Sư AOI,CÔNG TY TNHH TEST RESEARCH INNOVATION VIỆT NAM,Fresher/Entry level,0.0,0.0,0,Bắc Ninh,"Kỹ Thuật Điện Tử, Tự Động Hóa, Tiếng Trung, Xử Lý Sự Cố, Giao Tiếp",,information technology,5
2047312,Brand Designer,Công Ty CP Tư Vấn Thương Hiệu Sao Kim,Experienced (non-manager),0.0,0.0,0,Hà Nội,"Graphic Design, Adobe Illustrator, Photoshop, Figma, Attention To Detail",,information technology,5
2047580,Phó Phòng Tổ Chức Thi (Quản Lý Dữ Liệu),IIG Việt Nam,Manager,0.0,0.0,0,Hà Nội,"Quản Lý Dữ Liệu, Quản Trị Rủi Ro, Bảo Mật Thông Tin, PowerBI, Power Query",,information technology,5
2040385,Senior/expert Business Analyst - Tntech - 3K038,Tập Đoàn ROX (ROX Group),Experienced (non-manager),0.0,0.0,0,Hà Nội,"Phân Tích Xu Hướng Thị Trường, Giao Tiếp Chủ Động, Viết Tài Liệu, BPMN, UML",,information technology,5
2047688,"Chuyên Viên Kế Hoạch Kinh Doanh, Phân Tích Dữ Liệu (Business Planning Specialist)",Tập Đoàn Việt Group,Experienced (non-manager),0.0,0.0,0,Hà Nội,"Giải Quyết Vấn Đề, Giao Tiếp, Kế Hoạch Kinh Doanh, Làm Việc Nhóm, Phân Tích Dữ Liệu",,information technology,5
2040375,Kỹ Sư Phần Mềm Nhúng (Embedded Engineer) - Salary Upto 45M,"Soji Electronics.,jsc",Experienced (non-manager),0.0,0.0,0,Hà Nội,"Lập Trình Nhúng, Thiết Kế Hệ Thống Nhúng, C/C++, Firmware, FreeRTOS",,information technology,5
2047802,Kỹ Sư Máy X-Ray (Field Service Engineer),CÔNG TY TNHH TEST RESEARCH INNOVATION VIỆT NAM,Experienced (non-manager),0.0,0.0,0,Bắc Giang,"Kỹ Thuật Điện Tử, Tự Động Hóa, Tiếng Trung, Xử Lý Sự Cố, Giao Tiếp",,information technology,5
2040967,Chuyên Viên Chăm Sóc Và Hỗ Trợ Khách Hàng,Công Ty TNHH Taxsee Việt Nam,Fresher/Entry level,0.0,0.0,0,Nghệ An,"Sales, Customer Service, Marketing, Customer Relations, Promotional Campaigns",,information technology,5
2021116,Senior Data Engineer (AI / ADAS Data Loop) (1 Year contract),Bosch Global Software Technologies Company Limited,Experienced (non-manager),0.0,0.0,0,Hồ Chí Minh,"Python, AI, Data Engineer, Pandas",,information technology,4
2047403,Business Development Executive - Fluent in English,Ascendas Systems Co. Ltd,Experienced (non-manager),0.0,0.0,0,Hà Nội,"Bán Hàng Kỹ Thuật, Electrical Engineering, Software Analysis, CRM, Technical Support",,information technology,5
2047180,Kỹ Sư Cơ Điện,CÔNG TY CỔ PHẦN PIN ẮC QUY MIỀN NAM,Experienced (non-manager),0.0,0.0,0,Đồng Nai,"Lập Trình PLC, Thiết Kế Hệ Thống, Giao Thức Truyền Thông, Nghiên Cứu Năng Lượng Tái Tạo, Kỹ năng Tiếng Anh",,information technology,5
2040797,Manufacturing Quality Engineer,Nexthop AI,Experienced (non-manager),0.0,0.0,0,Bắc Ninh,"Electrical Engineering, Mechanical Engineering, Quality Engineer, Failure Analysis, Analytical Skills",,information technology,5
2050134,Sales/ Commercial Operations Specialist,GEEK Up,Experienced (non-manager),0.0,0.0,0,Hồ Chí Minh,"Sales Operation, Commercial Contract, Contract Management, English, problem-solving skills",,information technology,5
2041072,"Project Manager Java, Chinese, English",Công Ty TNHH Clever Creations Tech,Manager,0.0,0.0,0,Hồ Chí Minh,"Java, Spring Boot, MariaDB, Project Management, English",,information technology,5
2040466,Chuyên Viên Dữ Liệu Ban Chuyển Đổi Số,CÔNG TY CỔ PHẦN PHÂN BÓN DẦU KHÍ CÀ MAU,Experienced (non-manager),0.0,0.0,0,Hồ Chí Minh,"Data Modeling, ETL, SQL, English, Data Warehouse",,information technology,5
2050180,"BrSE (.NET, C#)",Navigos Search's Client,Experienced (non-manager),0.0,0.0,0,Hà Nội,"C#, ASP.NET, Technical Lead, Japanese N3, Software Development",,information technology,5
2050169,SA/ Tech Lead (.Net),Navigos Search's Client,Experienced (non-manager),0.0,0.0,0,Hà Nội,"C#, ASP.NET, SQL, PostgreSQL, Technical Lead",,information technology,5
2050157,IT ABAP Senior Specialist,Công ty TNHH TM DV Tân Hiệp Phát,Experienced (non-manager),0.0,0.0,0,Bình Dương,"ABAP Debugging, ABAP Report Programming, Lập Trình ABAP, SAP ABAP, SAP ABAP Development",,information technology,5
2050159,Quản Lý Dự Án CNTT,Navigos Search's Client,Experienced (non-manager),0.0,0.0,0,Hà Nội,"Project Management, Agile Methodology, Jira, Redmine, Customer Interaction",,information technology,5
2050036,Tư Vấn Chuyển Đổi Số Công Nghệ (Khối Chính Phủ),FPT IS,Experienced (non-manager),0.0,0.0,0,Hà Nội,"IT Consulting, Chuyển đổi số, BA, Solution Architecture",,information technology,4
2050033,Digital Workplace Solution Developer,Servier (Vietnam) Pharmaceutical Company,Experienced (non-manager),0.0,0.0,0,Hồ Chí Minh,"Microsoft Office 365, Microsoft Power Platform, Power Automate, SharePoint, Strategic Agility",,information technology,5
2049995,Talent Acquisition Specialist,GEEK Up,Experienced (non-manager),0.0,0.0,0,Hồ Chí Minh,"Business Partnering, Candidate Evaluation, Communication Skills, Recruitment, Stakeholder Management",,information technology,5
2049982,Senior Software Engineer (Java) - No English Requirement,Navigos Search,Experienced (non-manager),0.0,0.0,0,Hồ Chí Minh,"Docker, Java, Proactive Review, RESTful API, Spring Boot",,information technology,5
2040939,Kỹ sư Phần mềm 软件工程师,Strong Intelligence Equipment,Experienced (non-manager),0.0,0.0,0,Bắc Ninh,"C#, IT Phần Mềm, Software Process Development, Software Programming, Winform",,information technology,5
2044452,Senior QA Manager,Nakivo,Manager,0.0,0.0,0,Hồ Chí Minh,"Ci/Cd Methodologies, Defect Management, System Testing, Test Automation Tools",,information technology,4
2049968,"Fullstack Developer (Java, Angular)",Viettel IT Center - Viettel Group,Experienced (non-manager),0.0,0.0,0,Hà Nội,"Angular, Java, NgRx, Spring Boot, Teamwork",,information technology,5
2049943,"Teaching Assistant, Computing Technologies",RMIT University Vietnam,Experienced (non-manager),0.0,0.0,0,Hà Nội,"Teaching Experience, Cloud Technologies, Computer Science, Cyber Security, Software Engineering",,information technology,5
2042900,"Data & Reporting Officer, Credit Administration & Supervision Department, Head Office",Public Bank Vietnam Ltd,Experienced (non-manager),0.0,0.0,0,Hà Nội,"Analytical Skills, Data Analysis, Oracle BI, Statistical Reporting",,information technology,4
2045891,Chuyên Viên Cao Cấp Phân Tích Dữ Liệu Kinh Doanh (Data Analyst) – Khối Công Nghệ Thông Tin,Ngân hàng TMCP Tiên Phong (TPBank),Experienced (non-manager),0.0,0.0,0,Hà Nội,"Data Science, Phân Tích Dữ Liệu, Python Programming, SQL",,information technology,4
2045897,Chuyên Viên Cao Cấp Phân Tích Dữ Liệu Nâng Cao (Data Scientist) – Khối Công Nghệ Thông Tin,Ngân hàng TMCP Tiên Phong (TPBank),Experienced (non-manager),0.0,0.0,0,Hà Nội,"Data Science, Kubernetes, Phân Tích Dữ Liệu, Python",,information technology,4
